{
  "schema_version": "1.0.0",
  "scenario_id": "demo-dtc",
  "revision": "1",
  "country": "DE",
  "launch": "2026-07-01",
  "horizon": 12,
  "commercial": {
    "mode": "A",
    "level": {
      "value": 10000,
      "unit": "can/month",
      "kind": "ASSUMPTION",
      "source": "Synthetic MD-08/example input, not German evidence",
      "accepted": true
    },
    "mix": {
      "DTC Online": {
        "value": 0.6,
        "unit": "ratio",
        "kind": "ASSUMPTION",
        "source": "Synthetic MD-08/example input, not German evidence",
        "accepted": true
      },
      "Retail/Grocery": {
        "value": 0.4,
        "unit": "ratio",
        "kind": "ASSUMPTION",
        "source": "Synthetic MD-08/example input, not German evidence",
        "accepted": true
      }
    },
    "ramp": {
      "DTC Online": [
        {
          "value": 1,
          "unit": "ratio",
          "kind": "ASSUMPTION",
          "source": "Synthetic MD-08/example input, not German evidence",
          "accepted": true
        },
        {
          "value": 1,
          "unit": "ratio",
          "kind": "ASSUMPTION",
          "source": "Synthetic MD-08/example input, not German evidence",
          "accepted": true
        },
        {
          "value": 1,
          "unit": "ratio",
          "kind": "ASSUMPTION",
          "source": "Synthetic MD-08/example input, not German evidence",
          "accepted": true
        },
        {
          "value": 1,
          "unit": "ratio",
          "kind": "ASSUMPTION",
          "source": "Synthetic MD-08/example input, not German evidence",
          "accepted": true
        },
        {
          "value": 1,
          "unit": "ratio",
          "kind": "ASSUMPTION",
          "source": "Synthetic MD-08/example input, not German evidence",
          "accepted": true
        },
        {
          "value": 1,
          "unit": "ratio",
          "kind": "ASSUMPTION",
          "source": "Synthetic MD-08/example input, not German evidence",
          "accepted": true
        },
        {
          "value": 1,
          "unit": "ratio",
          "kind": "ASSUMPTION",
          "source": "Synthetic MD-08/example input, not German evidence",
          "accepted": true
        },
        {
          "value": 1,
          "unit": "ratio",
          "kind": "ASSUMPTION",
          "source": "Synthetic MD-08/example input, not German evidence",
          "accepted": true
        },
        {
          "value": 1,
          "unit": "ratio",
          "kind": "ASSUMPTION",
          "source": "Synthetic MD-08/example input, not German evidence",
          "accepted": true
        },
        {
          "value": 1,
          "unit": "ratio",
          "kind": "ASSUMPTION",
          "source": "Synthetic MD-08/example input, not German evidence",
          "accepted": true
        },
        {
          "value": 1,
          "unit": "ratio",
          "kind": "ASSUMPTION",
          "source": "Synthetic MD-08/example input, not German evidence",
          "accepted": true
        },
        {
          "value": 1,
          "unit": "ratio",
          "kind": "ASSUMPTION",
          "source": "Synthetic MD-08/example input, not German evidence",
          "accepted": true
        }
      ],
      "Retail/Grocery": [
        {
          "value": 1,
          "unit": "ratio",
          "kind": "ASSUMPTION",
          "source": "Synthetic MD-08/example input, not German evidence",
          "accepted": true
        },
        {
          "value": 1,
          "unit": "ratio",
          "kind": "ASSUMPTION",
          "source": "Synthetic MD-08/example input, not German evidence",
          "accepted": true
        },
        {
          "value": 1,
          "unit": "ratio",
          "kind": "ASSUMPTION",
          "source": "Synthetic MD-08/example input, not German evidence",
          "accepted": true
        },
        {
          "value": 1,
          "unit": "ratio",
          "kind": "ASSUMPTION",
          "source": "Synthetic MD-08/example input, not German evidence",
          "accepted": true
        },
        {
          "value": 1,
          "unit": "ratio",
          "kind": "ASSUMPTION",
          "source": "Synthetic MD-08/example input, not German evidence",
          "accepted": true
        },
        {
          "value": 1,
          "unit": "ratio",
          "kind": "ASSUMPTION",
          "source": "Synthetic MD-08/example input, not German evidence",
          "accepted": true
        },
        {
          "value": 1,
          "unit": "ratio",
          "kind": "ASSUMPTION",
          "source": "Synthetic MD-08/example input, not German evidence",
          "accepted": true
        },
        {
          "value": 1,
          "unit": "ratio",
          "kind": "ASSUMPTION",
          "source": "Synthetic MD-08/example input, not German evidence",
          "accepted": true
        },
        {
          "value": 1,
          "unit": "ratio",
          "kind": "ASSUMPTION",
          "source": "Synthetic MD-08/example input, not German evidence",
          "accepted": true
        },
        {
          "value": 1,
          "unit": "ratio",
          "kind": "ASSUMPTION",
          "source": "Synthetic MD-08/example input, not German evidence",
          "accepted": true
        },
        {
          "value": 1,
          "unit": "ratio",
          "kind": "ASSUMPTION",
          "source": "Synthetic MD-08/example input, not German evidence",
          "accepted": true
        },
        {
          "value": 1,
          "unit": "ratio",
          "kind": "ASSUMPTION",
          "source": "Synthetic MD-08/example input, not German evidence",
          "accepted": true
        }
      ]
    },
    "season": [
      {
        "value": 1,
        "unit": "ratio",
        "kind": "ASSUMPTION",
        "source": "Synthetic MD-08/example input, not German evidence",
        "accepted": true
      },
      {
        "value": 1,
        "unit": "ratio",
        "kind": "ASSUMPTION",
        "source": "Synthetic MD-08/example input, not German evidence",
        "accepted": true
      },
      {
        "value": 1,
        "unit": "ratio",
        "kind": "ASSUMPTION",
        "source": "Synthetic MD-08/example input, not German evidence",
        "accepted": true
      },
      {
        "value": 1,
        "unit": "ratio",
        "kind": "ASSUMPTION",
        "source": "Synthetic MD-08/example input, not German evidence",
        "accepted": true
      },
      {
        "value": 1,
        "unit": "ratio",
        "kind": "ASSUMPTION",
        "source": "Synthetic MD-08/example input, not German evidence",
        "accepted": true
      },
      {
        "value": 1,
        "unit": "ratio",
        "kind": "ASSUMPTION",
        "source": "Synthetic MD-08/example input, not German evidence",
        "accepted": true
      },
      {
        "value": 1,
        "unit": "ratio",
        "kind": "ASSUMPTION",
        "source": "Synthetic MD-08/example input, not German evidence",
        "accepted": true
      },
      {
        "value": 1,
        "unit": "ratio",
        "kind": "ASSUMPTION",
        "source": "Synthetic MD-08/example input, not German evidence",
        "accepted": true
      },
      {
        "value": 1,
        "unit": "ratio",
        "kind": "ASSUMPTION",
        "source": "Synthetic MD-08/example input, not German evidence",
        "accepted": true
      },
      {
        "value": 1,
        "unit": "ratio",
        "kind": "ASSUMPTION",
        "source": "Synthetic MD-08/example input, not German evidence",
        "accepted": true
      },
      {
        "value": 1,
        "unit": "ratio",
        "kind": "ASSUMPTION",
        "source": "Synthetic MD-08/example input, not German evidence",
        "accepted": true
      },
      {
        "value": 1,
        "unit": "ratio",
        "kind": "ASSUMPTION",
        "source": "Synthetic MD-08/example input, not German evidence",
        "accepted": true
      }
    ],
    "price_response": {
      "DTC Online": {
        "mode": "constant",
        "declaration": {
          "text": "Volume fixed at all prices; no price elasticity claimed",
          "kind": "ASSUMPTION",
          "source": "Synthetic demonstration, pending business validation",
          "accepted": true
        },
        "reference_price": {
          "value": 2.19,
          "unit": "EUR/can",
          "kind": "ASSUMPTION",
          "source": "Synthetic MD-08/example input, not German evidence",
          "accepted": true
        },
        "prices": [],
        "acceptance": [],
        "interpolate": false
      },
      "Retail/Grocery": {
        "mode": "constant",
        "declaration": {
          "text": "Volume fixed at all prices; no price elasticity claimed",
          "kind": "ASSUMPTION",
          "source": "Synthetic demonstration, pending business validation",
          "accepted": true
        },
        "reference_price": {
          "value": 2.19,
          "unit": "EUR/can",
          "kind": "ASSUMPTION",
          "source": "Synthetic MD-08/example input, not German evidence",
          "accepted": true
        },
        "prices": [],
        "acceptance": [],
        "interpolate": false
      }
    }
  },
  "marketing": {
    "paid": [
      {
        "value": 400,
        "unit": "EUR",
        "kind": "ASSUMPTION",
        "source": "Synthetic MD-08/example input, not German evidence",
        "accepted": true
      },
      {
        "value": 400,
        "unit": "EUR",
        "kind": "ASSUMPTION",
        "source": "Synthetic MD-08/example input, not German evidence",
        "accepted": true
      },
      {
        "value": 400,
        "unit": "EUR",
        "kind": "ASSUMPTION",
        "source": "Synthetic MD-08/example input, not German evidence",
        "accepted": true
      },
      {
        "value": 400,
        "unit": "EUR",
        "kind": "ASSUMPTION",